id,Website,Article_URL,Headline,Claim_Date,Review_Date,Query/Keyword,Label_Website,Image_URL,Original_Claim_Website,Original_Claim_Only,Context/Label_Explanation,Text_Only_Claim,Normal_Image,AI_Generated_Image,Altered_Image
44,Politifact,https://www.politifact.com/factchecks/2024/sep/30/social-media/no-link-between-ukraine-and-helene-aid-and-joe-bid/,“Biden Announces: ‘2.4 billion more to Ukraine’ but ‘no more aid for Hurricane Helene.’”,2024-09-30,2024-09-30,"""Ukraine""",FALSE,,"""Biden announces ‘$2.4 billion more to Ukraine"" but ""No more aid for Hurricane Helene,"" a Sept. 30 Facebook post said.",“Biden Announces: ‘2.4 billion more to Ukraine’ but ‘no more aid for Hurricane Helene.’”,"No link between Ukraine and Helene aid, and Joe Biden didn’t rule out future hurricane aid
In Sept. 29 remarks to reporters, President Joe Biden did not say no more aid would be provided for areas affected by Hurricane Helene. He also did not tie hurricane funding to Ukraine war funding; a Ukraine aid package Biden announced days earlier came from money Congress already appropriated.
Biden said all available resources were in place before the storm made landfall. A fact sheet detailed numerous steps the White House had taken, including issuing disaster and emergency declarations for affected states.
In a Sept. 30 White House address, Biden said he expects to ask Congress for a supplemental spending bill for hurricane aid.",Yes,No,No,No
45,Politifact,https://www.politifact.com/factchecks/2024/sep/20/facebook-posts/colin-kaepernick-isnt-russia-bound-this-claim-orig/,Colin Kaepernick said he “will go to Russia if not properly respected in the United States.”,2024-09-13,2024-09-20,"""Russia""",FALSE,,"""Colin Kaepernick: ‘Will go to Russia if not respected properly in the United States,’"" a Sept. 13 post said. ",Colin Kaepernick said he “will go to Russia if not properly respected in the United States.”,Colin Kaepernick isn’t Russia-bound; this claim originated on a self-described satire site.,Yes,No,No,No