AFP Factcheck,https://factcheck.afp.com/doc.afp.com.362U329,Photo of Israeli settlers clashing with police falsely shared as 'attack on Palestinian child',07/24,Israeli-Palestinian conflict,FALSE,No,No,https://c9mediaforum.afp.com/CacheServer/Cache.svc/g?hid=1E3E78A1B52FAAF991F4E71D07A8DC883D4E9392D3D299F3977BE7674F48108D1AC23E4546CAB633,"""Settler savages try to tear a Palestinian child apart in the occupied West Bank,"" read an https://web.archive.org/web/20240708084302/https://x.com/Sher_now1/status/1805963225239855441shared on June 26. ","However, a reverse image search on Google revealed the photo was taken years before the Israel-Hamas war broke out.
The photo, which is available in https://web.archive.org/web/20240708062031/https://www.afpforum.com/AFPForum/Search/ViewMedia.aspx?mui=1&hid=1E3E78A1B52FAAF991F4E71D07A8DC88593D4885B54C2A7F85C61FBF27ED56CD, was taken by Yehuda Raizner on September 13, 2009.
It shows settlers attempting to drag away a fellow settler from Israeli police during clashes in the West Bank.
""Israeli settlers try to pull a fellow settler as border policemen drag him away during clashes at the entrance to the illegal outpost of Havat Gilad, west of the occupied West Bank city of Nablus, after Israeli police tried to confiscate a truck containing material to build a new house on September 13, 2009,"" the photo caption reads.",,
AFP Factcheck,https://factcheck.afp.com/doc.afp.com.362D3LA,"Google has not removed 'Palestine' from maps amid Gaza war

",07/24,Israeli-Palestinian conflict,FALSE,No,No,,"""Google removed Palestine from maps,"" read the caption alongside a https://web.archive.org/web/20240708025231/https://www.facebook.com/plugins/video.php?height=476&href=https%3A%2F%2Fwww.facebook.com%2Fdada.dadabhai.9%2Fvideos%2F928651542283484%2F%3Fidorvanity%3D4233110866762942&show_text=true&width=1428&t=0 posted on June 12, 2024 in a Facebook group with more than 328,000 members.","A spokesperson for Google told AFP in an email on July 9, 2024 that it had not changed how ""Palestine"" is depicted on Google Maps.
They said a search for ""Palestine"" on Google Maps would show a map of the area with labels for the West Bank and the Gaza Strip but -- since there is no clear consensus across international bodies on its territories -- they could not reliably show and label its borders at this time.",,
AFP Factcheck,https://factcheck.afp.com/doc.afp.com.362G9KF,Old photo of pink dress on Turkey grave falsely linked to Gaza war,07/24,Israeli-Palestinian conflict,FALSE,No,No,https://pbs.twimg.com/media/FuL23EuWcA4QQjl?format=jpg&name=900x900,"""A Palestinian father leaves Eid clothes on his daughter's grave (8 years old),"" read a https://perma.cc/4HJQ-59ZY?type=image that shared the photos on June 24.","Turkey cemetery
Reverse image searches and keyword searches on Google found one of the photos in an https://x.com/hesaniko/status/1649151855631429658 from April 21, 2023 -- months before the outbreak of the Gaza war (https://perma.cc/TW4N-2TN7).
The Turkish-language post reads: ""Zahide (8 years old) bought and left an Eid dress for her sibling this Eid. Some photos and memories stay like a paper cut scar in my life.""


The cemetery was overwhelmed with dead after a huge 7.8-magnitude earthquake struck Turkey on February 6, 2023, The Financial Times https://www.ft.com/content/e92eadda-e19a-4211-8e1f-b50548a95757 (https://perma.cc/YZ49-E2J5).
The quake claimed more than 53,000 lives in Turkey and nearly 6,000 in neighbouring Syria.",,